{
  "Header": {
    "Value": {
      "Bin": "610014",
      "Version": "D0",
      "TransactionCode": "B1",
      "Pcn": "TEST",
      "RecordCount": 1,
      "ServiceProviderIdQualifier": "01",
      "ServiceProviderId": "1234567890",
      "DateOfService": "20240115",
      "SoftwareVendorCertificationId": "VENDOR1234"
    }
  },
  "Insurance": {
    "Cardholder": {
      "Id": "12345678901",
      "FirstName": "JOHN",
      "LastName": "DOE"
    },
    "GroupId": "GRP001",
    "PersonCode": "01",
    "PatientRelationshipCode": "1"
  },
  "Patient": {
    "IdQualifier": "01",
    "Id": "12345678901",
    "BirthDate": "1980-05-15",
    "GenderCode": "1",
    "FirstName": "JOHN",
    "LastName": "DOE",
    "Address": {
      "Street": "123 MAIN ST",
      "City": "ANYTOWN",
      "State": "NY",
      "Zip": "12345"
    },
    "Phone": "5551234567",
    "PlaceOfService": "01"
  },
  "Claims": [
    {
      "Claim": {
        "PrescriptionServiceReference": {
          "Qualifier": "1",
          "Number": "1234567890"
        },
        "ProductService": {
          "Qualifier": "03",
          "Id": "00000123456"
        },
        "QuantityDispensed": 30.0,
        "FillNumber": "00",
        "DaysSupply": 30,
        "CompoundCode": "1",
        "DispenseAsWritten": "0",
        "DateWritten": "2024-01-10",
        "RefillsAuthorized": 5,
        "OriginCode": "1",
        "OtherCoverageCode": "0"
      },
      "Pricing": {
        "IngredientCostSubmitted": 100.0,
        "DispensingFeeSubmitted": 2.5,
        "GrossAmountDue": 102.5,
        "UsualAndCustmaryCharge": 102.5,
        "BasisOfCostDetermination": "01"
      },
      "Pharmacy": {
        "IdQualifier": "01",
        "Id": "1234567890"
      },
      "Prescriber": {
        "IdQualifier": "01",
        "Id": "1234567890",
        "LastName": "SMITH",
        "FirstName": "JANE"
      }
    }
  ]
}
